{
  "documentType": "geomotion-project",
  "formatVersion": 1,
  "project": {
    "projectId": "11111111-1111-4111-8111-111111111111",
    "name": "Fixture técnico mínimo",
    "sceneIds": ["22222222-2222-4222-8222-222222222222"],
    "activeSceneId": "22222222-2222-4222-8222-222222222222"
  },
  "scenes": [
    {
      "sceneId": "22222222-2222-4222-8222-222222222222",
      "projectId": "11111111-1111-4111-8111-111111111111",
      "name": "Escena técnica",
      "order": 0,
      "mapViewId": "33333333-3333-4333-8333-333333333333",
      "operationalState": "ACTIVE"
    }
  ],
  "mapViews": [
    {
      "mapViewId": "33333333-3333-4333-8333-333333333333",
      "sceneId": "22222222-2222-4222-8222-222222222222",
      "mode": "2D",
      "center": { "longitude": 0, "latitude": 0 },
      "zoom": 1,
      "baseMapRef": "natural-earth-110m-physical"
    }
  ]
}
